{
  "schemaVersion": "1.0.0",
  "curriculumVersionId": "state-boards-class-07@2026.1.0",
  "boardId": "state-boards",
  "boardName": "State Boards (SCERT / MSBSHSE / TN-DGE Equivalency Spine)",
  "yearId": "class-07",
  "yearLabel": {
    "en": "Class 7",
    "hi": "कक्षा 7"
  },
  "nepStage": "middle-classes-6-8",
  "ageBandYears": "12-13 years",
  "groundingStatus": "skeleton-with-labelled-gaps",
  "screenTimePolicy": {
    "maxMinutesPerDay": 60,
    "deliveryMode": "independent-with-breaks",
    "guidelineSourceId": "SRC-IAP-SCREENTIME-2022"
  },
  "subjects": [
    {
      "subjectId": "mathematics-ganita-prakash",
      "name": {
        "en": "Mathematics (Ganita Prakash)",
        "hi": "गणित (गणित प्रकाश)"
      },
      "compulsory": true,
      "stream": "general",
      "textbooks": [
        "NCERT Ganita Prakash (NCF-SE 2023 Series)"
      ],
      "skillIds": [
        "math-integers-number-patterns",
        "math-ratios-linear-algebra-middle",
        "math-geometry-mensuration-middle"
      ],
      "sourceIds": [
        "SRC-STATE-MSBSHSE-2026",
        "SRC-NCERT-NCFSE-2023",
        "SRC-NCERT-NSTC-2023"
      ],
      "units": [
        {
          "unitId": "state-boards-class-07-math-u1",
          "title": {
            "en": "Unit 1: Patterns in Mathematics, Prime Time & Number Play",
            "hi": "इकाई 1: गणित में पैटर्न, अभाज्य संख्याएं और संख्या खेल"
          },
          "notionalHours": 45,
          "skillIds": [
            "math-integers-number-patterns"
          ],
          "competencies": [
            "Identifies figurate number sequences, Virahanka numbers, and prime factorisation trees",
            "Evaluates divisibility tests, HCF/LCM, and integer operations on the number line"
          ]
        },
        {
          "unitId": "state-boards-class-07-math-u2",
          "title": {
            "en": "Unit 2: Fractions, Rational Numbers, Ratios & Linear Algebra",
            "hi": "इकाई 2: भिन्न, परिमेय संख्याएं, अनुपात और रैखिक बीजगणित"
          },
          "notionalHours": 65,
          "skillIds": [
            "math-ratios-linear-algebra-middle"
          ],
          "competencies": [
            "Models multi-step word problems using algebraic expressions and linear equations",
            "Solves percentage, profit/loss, simple/compound interest, and direct/inverse proportion tasks"
          ]
        },
        {
          "unitId": "state-boards-class-07-math-u3",
          "title": {
            "en": "Unit 3: Lines and Angles, Triangles, Symmetry & Perimeter/Area/Volume",
            "hi": "इकाई 3: रेखाएं और कोण, त्रिभुज, सममिति तथा क्षेत्रमिति"
          },
          "notionalHours": 60,
          "skillIds": [
            "math-geometry-mensuration-middle"
          ],
          "competencies": [
            "Constructs geometric figures with ruler and compass and proves triangle congruence",
            "Computes area of polygons and surface area/volume of cubes, cuboids, and cylinders"
          ]
        }
      ]
    },
    {
      "subjectId": "science-curiosity",
      "name": {
        "en": "Integrated Science (Curiosity)",
        "hi": "एकीकृत विज्ञान (जिज्ञासा)"
      },
      "compulsory": true,
      "stream": "general",
      "textbooks": [
        "NCERT Curiosity Science Textbook (NCF-SE 2023 Series)"
      ],
      "skillIds": [
        "sci-curiosity-middle-inquiry"
      ],
      "sourceIds": [
        "SRC-STATE-MSBSHSE-2026",
        "SRC-NCERT-NCFSE-2023",
        "SRC-NCERT-NSTC-2023"
      ],
      "units": [
        {
          "unitId": "state-boards-class-07-sci-u1",
          "title": {
            "en": "Unit 1: Materials Around Us, States of Water & Separation Methods",
            "hi": "इकाई 1: हमारे चारों ओर के पदार्थ, जल की अवस्थाएं और पृथक्करण"
          },
          "notionalHours": 50,
          "skillIds": [
            "sci-curiosity-middle-inquiry"
          ],
          "competencies": [
            "Classifies materials by solubility, density, conductivity, and chemical change",
            "Designs filtration, evaporation, and distillation experiments"
          ]
        },
        {
          "unitId": "state-boards-class-07-sci-u2",
          "title": {
            "en": "Unit 2: Living Creatures, Mindful Eating, Cell & Body Movements",
            "hi": "इकाई 2: सजीव जगत, संतुलित आहार, कोशिका और शरीर की गति"
          },
          "notionalHours": 55,
          "skillIds": [
            "sci-curiosity-middle-inquiry"
          ],
          "competencies": [
            "Tests food samples for carbohydrates, proteins, and fats and maps deficiency prevention",
            "Explains plant/animal adaptations, respiration, and microscopic cell structures"
          ]
        },
        {
          "unitId": "state-boards-class-07-sci-u3",
          "title": {
            "en": "Unit 3: Measurement of Length/Motion, Temperature, Magnets & Beyond Earth",
            "hi": "इकाई 3: लंबाई और गति का मापन, तापमान, चुंबक और अंतरिक्ष"
          },
          "notionalHours": 55,
          "skillIds": [
            "sci-curiosity-middle-inquiry"
          ],
          "competencies": [
            "Measures SI units, plots distance-time graphs, and builds simple electric and magnetic circuits",
            "Explains heat transfer (conduction, convection, radiation) and solar system dynamics"
          ]
        }
      ]
    },
    {
      "subjectId": "social-science-exploring-society",
      "name": {
        "en": "Social Science (Exploring Society: India and Beyond)",
        "hi": "सामाजिक विज्ञान (समाज की खोज: भारत और उससे आगे)"
      },
      "compulsory": true,
      "stream": "general",
      "textbooks": [
        "NCERT Exploring Society: India and Beyond (NCF-SE 2023 Series)"
      ],
      "skillIds": [
        "soc-exploring-society-middle"
      ],
      "sourceIds": [
        "SRC-STATE-MSBSHSE-2026",
        "SRC-NCERT-NCFSE-2023",
        "SRC-NCERT-NSTC-2023"
      ],
      "units": [
        {
          "unitId": "state-boards-class-07-soc-u1",
          "title": {
            "en": "Themes A & B: India and the World (Landforms, Oceans) & Tapestry of the Past",
            "hi": "विषय A और B: भू-आकृतियां, महासागर और अतीत की धरोहर"
          },
          "notionalHours": 65,
          "skillIds": [
            "soc-exploring-society-middle"
          ],
          "competencies": [
            "Locates latitudes, longitudes, time zones, and major landforms on thematic maps",
            "Analyses Harappan urban planning, Vedic/Janapada traditions, and historical sources"
          ]
        },
        {
          "unitId": "state-boards-class-07-soc-u2",
          "title": {
            "en": "Themes C, D & E: Cultural Heritage, Grassroots Democracy & Economic Life",
            "hi": "विषय C, D और E: सांस्कृतिक विरासत, जमीनी लोकतंत्र और आर्थिक जीवन"
          },
          "notionalHours": 65,
          "skillIds": [
            "soc-exploring-society-middle"
          ],
          "competencies": [
            "Compares Three-Tier Panchayati Raj and Urban Local Bodies governance structures",
            "Classifies primary, secondary, and tertiary economic activities and household budgeting"
          ]
        }
      ]
    },
    {
      "subjectId": "languages-poorvi-malhar",
      "name": {
        "en": "Bilingual Languages: English (Poorvi) & Hindi (Malhar)",
        "hi": "द्विभाषी भाषाएं: अंग्रेजी (पूर्वी) और हिंदी (मल्हार)"
      },
      "compulsory": true,
      "stream": "general",
      "textbooks": [
        "NCERT Poorvi (English)",
        "NCERT Malhar (Hindi)"
      ],
      "skillIds": [
        "lang-bilingual-literature-middle"
      ],
      "sourceIds": [
        "SRC-STATE-MSBSHSE-2026",
        "SRC-NCERT-NCFSE-2023"
      ],
      "units": [
        {
          "unitId": "state-boards-class-07-lang-u1",
          "title": {
            "en": "Literature, Grammar in Context, Unseen Reading & Essay Writing",
            "hi": "साहित्य पठन, संदर्भगत व्याकरण, अपठित गद्यांश और निबंध लेखन"
          },
          "notionalHours": 140,
          "skillIds": [
            "lang-bilingual-literature-middle"
          ],
          "competencies": [
            "Synthesizes themes across Indian and global prose/poetry in Hindi and English",
            "Drafts structured essays, notices, and formal letters with accurate syntax"
          ]
        }
      ]
    },
    {
      "subjectId": "computational-ai-vocational",
      "name": {
        "en": "Computational Thinking, Coding & Vocational Exposure (Kaushal Bodh)",
        "hi": "कम्प्यूटेशनल चिंतन, कोडिंग और कौशल बोध"
      },
      "compulsory": true,
      "stream": "vocational",
      "textbooks": [
        "NCERT Kaushal Bodh (Vocational Education)",
        "CBSE Coding & AI Modules"
      ],
      "skillIds": [
        "comp-algorithmic-ai-literacy"
      ],
      "sourceIds": [
        "SRC-STATE-MSBSHSE-2026",
        "SRC-NCERT-NCFSE-2023"
      ],
      "units": [
        {
          "unitId": "state-boards-class-07-comp-u1",
          "title": {
            "en": "Algorithms, Data Tables, Python Basics & Ethical AI",
            "hi": "एल्गोरिदम, डेटा तालिका, पायथन परिचय और नैतिक एआई"
          },
          "notionalHours": 60,
          "skillIds": [
            "comp-algorithmic-ai-literacy"
          ],
          "competencies": [
            "Designs flowcharts, loops, and conditional logic for real-world problems",
            "Completes hands-on Kaushal Bodh projects across data, ecology, and community service"
          ]
        }
      ]
    }
  ],
  "skillIds": [
    "math-integers-number-patterns",
    "math-ratios-linear-algebra-middle",
    "math-geometry-mensuration-middle",
    "sci-curiosity-middle-inquiry",
    "soc-exploring-society-middle",
    "lang-bilingual-literature-middle",
    "comp-algorithmic-ai-literacy"
  ],
  "termPlan": [
    {
      "termId": "term-1",
      "title": {